{
  "$schema": "https://json-schema.org/draft/2020-12/schema",
  "$id": "https://lane-relay.local/schemas/card.schema.json",
  "title": "CardMaster",
  "type": "object",
  "required": ["id", "name", "rarity", "mp_cost", "effects"],
  "additionalProperties": false,
  "properties": {
    "id": {
      "type": "string",
      "pattern": "^card_[a-z0-9_]+$"
    },
    "name": {
      "type": "string",
      "minLength": 1
    },
    "rarity": {
      "type": "string",
      "enum": ["common", "rare", "epic", "legendary"]
    },
    "mp_cost": {
      "type": "integer",
      "minimum": 0
    },
    "consumes_action": {
      "type": "boolean"
    },
    "effects": {
      "type": "array",
      "minItems": 1,
      "items": {
        "$ref": "definitions/effect.schema.json"
      }
    },
    "roll_rules": {
      "type": "array",
      "items": {
        "$ref": "definitions/roll_rule.schema.json"
      }
    }
  }
}
