{
  "id": "card_claw",
  "name": "ひっかき",
  "rarity": "common",
  "mp_cost": 0,
  "effects": [
    {
      "type": "damage",
      "target": "enemy",
      "power": 5,
      "scope": "local",
      "damage_type": "true",
      "base_damage": 5,
      "scaling": []
    }
  ],
  "consumes_action": true
}
